comment,score
外形外观：手机大小合适，缺点是手机壳有划手的感觉，最后我用刀子刮了之后好多了，但是刮过的始终不怎么美观，不刮摸着伤手，是你你咋选？待机时间：还是挺长的屏幕音效：声音清楚大声,4
手机好看，音质好，声音又大，价格还便宜，可惜手机不在身边，无法拍摄，有机会再拍,5
蛮好的，满轻的，声音蛮大的，先用用再说,5
外形外观：手机小巧，方便携带屏幕音效：屏幕特别贴心，还贴有膜待机时间：待机时间长，电池容量大,5
用着挺好的，电池耐用,5
外形外观：美观大方屏幕音效：清析声音好大拍照效果：还不错运行速度：还可以待机时间：也比较长了其他特色：都还好,5
外形外观：外形美观拍照效果：摄像高清运行速度：运行速度快6G内存屏幕音效：音效立体声待机时间：待机时间长，31天其他特色：老板态度好,5
外形外观：外观好看，给妈妈买的，收到后她很高兴，以前买的手机电池坏了，老充不上电，一搞就关机，想跟她打个电话都打不通，想想还是给她换个手机吧，在京东上看了好久，终于相中这款，主要是觉得信价比高吧，金立老牌子了，相信它，屏幕音效：还可以吧拍照效果：没试运行速度：还行待机时间：比较长,5
挺醒目的红色，声音也大，拿到手就给老妈用上了，待机时间还不清楚,5
屏幕音效：挺好的，正在使用中声音大，就是太轻了，质量还不知道怎么样，感觉挺好的。,5
奶奶的新手机，不错，有语音报名字，电话号码的功能。,5
这款老人机外观还是蛮不错的，机身厚度也可以！老人用用蛮不错的！,5
外观大方，样式美观。妈妈喜欢的颜色，声音大，清晰度高。,5
妈妈喜欢，希望电池足够好，千万别半年就废了，祈祷，祈祷，祈祷,5
外形外观：红色挺喜庆的屏幕音效：声音大，适合老人运行速度：按键灵敏,5
按键手感不错，屏幕清晰，声音大！,5
外形外观：好看屏幕音效：好大待机时间：长久运行速度：快速拍照效果：好看,5
给老人买的，试用了一下，还不错，待机可以，声音也比较大。,5
婆婆和妈妈年岁大了，不会用智能手机，一直是这个牌子的老人机，这是我家买的第三部了！,5
给外婆买的，电信卡还有问题，所以还不能确定手机的质量，先给好评,5
手机不错，拿回家给老人用完全足够了,5
手机不错，音量大，老人用是最实惠的,5
给老妈买的，目前感觉还不错，在以后的使用当中再继续体验是否满意！,5
外形外观：拿在手里长度正好屏幕音效：字大，声音大,5
电池耐用，操作简单，适合不识字的老人,5
操作简单，适合老年人使用。,5
手机还可以，比较适合老年人，待机久还轻便。,5
手机声音大，老人家容易学会，挺好的一款手机,5
买比老爸用的，我问佢好唔好用，佢话好好用,5
买给老妈用的，老妈说不错，好用也好看！,5
音量大，待机时间长，是送给老人的上品,5
手机不错，音量大，老人用是最实惠的,5
给老妈买的，目前感觉还不错，在以后的使用当中再继续体验是否满意！,5
外形外观：拿在手里长度正好屏幕音效：字大，声音大,5
电池耐用，操作简单，适合不识字的老人,5
操作简单，适合老年人使用。,5
手机还可以，比较适合老年人，待机久还轻便。,5
手机声音大，老人家容易学会，挺好的一款手机,5
买比老爸用的，我问佢好唔好用，佢话好好用,5
买给老妈用的，老妈说不错，好用也好看！,5
音量大，待机时间长，是送给老人的上品,5
老人机不错，音量大，按键数字大,5
外形外观：老人用，简单，方便，还行。,5
待机时间长，给老妈用刚刚好?,5
其他特色：不错，能解锁锁屏，打电话耶可以,5
待机时间：待机十天左右，外形外观：小巧精致,5
实惠，方便老人使用！操作简单！,5
运行速度：快外形外观：美屏幕音效：好,5
挺好的，适合老人使用，方便。,5
手机已收到，外观不错，快递小哥也给力,5
待机时间：待机时间长，声音大值得购买,5
还行，婆婆只喜欢用老人手机,5
外形外观：机子就是音量小了點其他還可以,5
待机时间：待机时间长，外形美观大方,5
关键时期发货速度挺快，价格也比较合适。,5
手机音量大，待机时间长,5
音量大，操作简单，适合老人用,5
应该还可以，买给长辈用，简单就好,5
可以，效果好，不错，值得购买，，，,5
买给妈妈用写大声音大好用,5
老用挺好的，声音大，,5
老年人用到还不错，行动吧,5
质量还可以，服务态度好。,5
还不错。买给家里老人用的。。。。。。。。,5
比较适合年龄大的使用,5
还可以，充电一次用一周,5
真的不错的一次购物体验。,5
100多元的手机，也就那样。能接打电话就行了！,5
第一只用了两年了，换一只新的了该,5
老年手机，声音大？我只有哈哈……,5
不知道怎么样，主要是价格相对便宜，只是为了接听电话。,5
外形外观：看着还是不错的，老人用也比较时尚。屏幕音效：屏幕舒适度很好，音效不错很喜欢。拍照效果：拍照效果挺好的比较喜欢运行速度：行 速度上还是非常好的，其他特色：手机还是喜欢华为的，质量绝对好，使用后系统马上自动升级了使用非常方便。支持华为支持国产。,5
外形外观：挺好的，大小也适合。手机手感也好。屏幕音效：屏幕色彩不错。音质也好。拍照效果：像素挺好。拍出来的照片也挺真实的。视屏效果也好。运行速度：反应挺快的。这比原来用过的手机反应挺快的。待机时间：充电很快。待机时间也长。正常待机3天都可以。其他特色：总体来说手机可以。物美价廉。,5
手机外观很好看，感觉特别精致，全面屏的，手感很好，背面的渐变色也比较时尚，还贴了钢化膜，运行速度挺快，带电时间长，很喜欢的一次购物,5
运行速度：非常快外形外观：漂亮屏幕音效：音质棒棒哒拍照效果：非常清晰待机时间：不错,5
荣耀10青春版给老爸买的，他觉得外观很好看，蓝色低调，但不单调，会折射出一种彩纹很好看。系统简易模式很贴心，很适合老人使用，设置界面简单，字体大，操作方便。拍照清晰，自拍美颜自然，瞬间变年轻，老爸很满意。购买的时候对比了荣耀9X，虽然那个处理好，但这款更便宜，相比之下，我觉得这款更适合老人，父母不玩游戏，荣耀10青春版的处理器完全够用,5
京东购物支持，华为的此款手机，整体性能都不错，使用起来顺流畅度挺好，值得推荐。屏幕颜色，这些做工都值得称赞，物流业特别快，下了单过后就很快送到，物品中配了一个耳机，看起来还行吧。收到的，这个机器赠送了一个手机，壳，手机屏幕上开贴了一个保护膜，,5
外形外观：渐变蓝很好看屏幕音效：屏幕很清晰拍照效果：较好运行速度：运行6G其他特色：妈妈买的渐变红，爸爸渐变蓝，我是海鸥灰，全部都是荣耀，喜欢。,5
该机型小巧玲珑，机身轻、薄，操作系统反应很快，握感不错。,5
外观及颜色很精美.手感舒服运行速度快很流畅，感觉这个手机性价比很高，比以前用过手机流畅多了,5
运行速度：运行速度很快，打王者和平精英一点都不卡。观看电影，电视剧很流畅。其他特色：手机钢化膜寄过来的时候碎了。客服的处理结果让我满意。电池很耐用，京东小哥的配送很快。快递服务很贴心。,5
外形外观：看着还是不错的，老人用也比较时尚。屏幕音效：屏幕舒适度很好，音效不错很喜欢。拍照效果：拍照效果挺好的比较喜欢运行速度：行 速度上还是非常好的，其他特色：手机还是喜欢华为的，质量绝对好，使用后系统马上自动升级了使用非常方便。支持华为支持国产。,5
外形外观：挺好的，大小也适合。手机手感也好。屏幕音效：屏幕色彩不错。音质也好。拍照效果：像素挺好。拍出来的照片也挺真实的。视屏效果也好。运行速度：反应挺快的。这比原来用过的手机反应挺快的。待机时间：充电很快。待机时间也长。正常待机3天都可以。其他特色：总体来说手机可以。物美价廉。,5
手机外观很好看，感觉特别精致，全面屏的，手感很好，背面的渐变色也比较时尚，还贴了钢化膜，运行速度挺快，带电时间长，很喜欢的一次购物,5
运行速度：非常快外形外观：漂亮屏幕音效：音质棒棒哒拍照效果：非常清晰待机时间：不错,5
荣耀10青春版给老爸买的，他觉得外观很好看，蓝色低调，但不单调，会折射出一种彩纹很好看。系统简易模式很贴心，很适合老人使用，设置界面简单，字体大，操作方便。拍照清晰，自拍美颜自然，瞬间变年轻，老爸很满意。购买的时候对比了荣耀9X，虽然那个处理好，但这款更便宜，相比之下，我觉得这款更适合老人，父母不玩游戏，荣耀10青春版的处理器完全够用,5
京东购物支持，华为的此款手机，整体性能都不错，使用起来顺流畅度挺好，值得推荐。屏幕颜色，这些做工都值得称赞，物流业特别快，下了单过后就很快送到，物品中配了一个耳机，看起来还行吧。收到的，这个机器赠送了一个手机，壳，手机屏幕上开贴了一个保护膜，,5
外形外观：渐变蓝很好看屏幕音效：屏幕很清晰拍照效果：较好运行速度：运行6G其他特色：妈妈买的渐变红，爸爸渐变蓝，我是海鸥灰，全部都是荣耀，喜欢。,5
该机型小巧玲珑，机身轻、薄，操作系统反应很快，握感不错。,5
外观及颜色很精美.手感舒服运行速度快很流畅，感觉这个手机性价比很高，比以前用过手机流畅多了,5
运行速度：运行速度很快，打王者和平精英一点都不卡。观看电影，电视剧很流畅。其他特色：手机钢化膜寄过来的时候碎了。客服的处理结果让我满意。电池很耐用，京东小哥的配送很快。快递服务很贴心。,5
手机收到查询是正品行货，华为官方质保1年，还送了耳机，手机壳，手机系统流畅。很好,5
这款手机值得购买，性价比高,5
外形外观：外观靓丽，大小正好，一只手操作很舒服！屏幕音效：屏幕分辨率很不错，时间长了不晃眼。拍照效果：拍照效果很不错，这个价位很惊艳……运行速度：运行速度满足日常需要，手机刚开始用还看不出效果，日后再追平！待机时间：待机时间很不错，老爸很喜欢。其他特色：总体性价比超高！过年期间快递也很给力！,5
这手机外观漂亮，而且滑动很灵敏，质量好，内存又大，非常喜欢?,5
发货很快，当天下单当天就发货了，很快收到。手感很好，我喜欢黑色，很棒，拿起来很轻便，反应很快，手机很棒！！！,5
信赖京东，信赖华为，物流也是很给力，手机手感好，大小合适，赞赞赞?? ??,5
京东商城上面购物非常给力，价格实惠，卖家服务态度也非常赞，提的问题很快得到回复!物流非常快，第一天购买，第三天就收到了！手机收到非常喜欢，华为手机国产品牌老大，屏幕清晰，触碰手感不错，运行速度也非常快，非常满意！赞赞赞,5
运行速度：运行很快，打游戏不卡顿。外形外观：外观很好，老婆非常喜欢！,5
外形外观：时尚，美观屏幕音效：清晰，音质好拍照效果：像素清晰运行速度：超出想像待机时间：时间还可以其他特色：价格实惠，物有所值,5
运行速度：速度相当好，反应特灵敏外形外观：挺喜欢的拍照效果：自拍效果很好,5
手机很好，内存也够我使用，玩起游戏来也很流畅，运行速度很快，手机外形外观也很漂亮值得购买。,5
手机很满意，照相很清晰，听音乐，音质也很好，运行速度很快,5
外形外观：美观大方，给老婆买的，喜欢的很屏幕音效：效果真棒，不错拍照效果：清晰得不能再轻易咯,5
外形外观：好看屏幕音效：可以拍照效果：特别好运行速度：快,5
买给爸妈的，很好，使用起来呀不卡顿，非常喜欢，下次如果需要还会考虑的,5
外形外观：手机颜值还是很高的，运行速度：用起来很流畅，性价比也特别高，,5
整体满意，期待后续使用。1、价格没的说，性价比超高。2、配件很多，满满的诚意。3、物流还可以，没有超出意外。,5
荣耀手机真好屏幕大价格又不贵，屏幕清晰，流畅又不卡顿，给老人真合适。,5
外形外观：手机质量很好，运行很快，真心不错，值得我们购买，客服态度很好。,5
手机不错，外观不错，手感不错，性能不错，包装不错，物流不错，都很不错。好评就用这段话了。京东的品牌值得信赖，产品质量也不错，经常会有满减的活动，比超市价格便宜。其实，最好的就是京东的物流，预计的时间比较准确，有时候还会提前。配送小哥都蛮负责任，很有礼貌。,5
外形外观：质量很不错，运行也很快，真心不错，值得推荐，客服态度很好。,5
手机已收到 正品 运行挺流畅的 卖家服务态度很好  物流也挺给力 给父母买的 挺高兴的,5
手机颜色很喜欢，运行很快，价格实惠，客服态度没得说，真心不错的。,5
外形外观：外形好看，黑色外观大气。拍照效果：拍照效果很清晰。运行速度：运行速度快，看视频很流畅。其他特色：使用轻便，整体效果不错，性价比高，满意。收到时，钢化膜坏了，客服服务态度很好，给我进行了补偿。,5
支持国产，支持华为，用了一下午，机器非常流畅，外型也漂亮，最重要是价格便宜，以后还会光顾,5
手机挺好看的，目前来看也很好用，只是耗电快……续航能力不强……,5
刚开始我还担心会不是正品，后面有那个码查了是正品！非常喜欢了，价格比别家又优惠。太值了！,5
手机一如既往的好，物流也很快，满意满意，支持华为！,5
手机快递很快，包裹的也很好，防止快递员扔来扔去。屏幕全屏很舒服，用起来比苹果还要好用，运行速度也快，音效很棒，值得买的一款手机，推荐大家入手,5
超级快，一天就到了。感觉现在京东物流和顺丰快递时间都是一样的了。手机很好，玩游戏很畅快，性价比很高。送了小礼品，很贴心。,5
超级大气，很好看，上档次呀。质感很好，打游戏也很好,5
外形外观：外观漂亮，京东快递都送到农村了，值得赞。屏幕音效：不错拍照效果：还算清晰运行速度：老人用，很好待机时间：够用,5
终于收到啦，很漂亮是我喜欢的，像素也很清晰，声音够大，玩游戏也不怎么耗电哦，服务态度相当好。很满意的一次购物，下次有需要还会光顾的,5
快递也快，手机也很好，正品，送的东西也多，优惠力度大，比我在实体店买的还便宜，送的东西也好，必须?这个是买给老婆的，和我的一样,5
买了两个，送爸妈的，他们很喜欢，非常好,5
宝贝收到了，颜色很漂亮，上手有质感，反应很快，喜欢宝贝的亲们赶紧下单吧,5
外形外观：完美运行速度：很快给我爸用的非常满意,5
用了几天了，感觉不错，很流畅，反应很快，电池也耐用，不玩游戏，刷刷~，聊聊~什么的，一天下来还有三四十的电量，全屏手机刚刚用起来还不习惯，老想着一键返回????……以前一直用三星的……后来棒子弄**，果断不买棒子货了。手机寿命最多也就两年多，更新换代太快了，不换就各种卡，果断支持华为，,5
初衷是想买个贵点好点的，在朋友的推荐下，抱着试试看的心态购买了此款手机，想想先将就着用吧，春节回家闲来无事，给小孙子拍了一组特写镜头发送家人群，竟得到一至好评，问我什么手机拍的，效果这么好，小侄儿也因此购买了一台，不禁开始喜欢这款手机了，价廉物美，值了。,5
手感，速度都很好，拍照很清晰，送人很好,5
手机颜色很漂亮，性能好，速度快，性价比高。还送了小礼物，很开心。非常满意?,5
非常好的一部手机，选择高配没错的，尽管这款机型高配整体性价比偏软，但为了使用长久舒心一点。手机整体灰常漂亮，造型，尺寸都非常适合儿子。不管怎样，它的技术还都是当下比较流行的技术。开机运行很流畅，不打游戏，很少聊~，日常拍照，看视频还是富富有余滴。也有很多机油说运行吃鸡，王者也很流畅，本人无这方面喜好，就不实验了。,5
很漂亮，大小也合适，送保护套，膜贴了一个，但不是钢化膜。可以把字体调很大，老人家看起来也很容易。运行速度也很快，不过也还没安装很多软件，送给家里老人，目前一切满意。,5
手机很不错，买给丈母娘的，她很喜欢。外形大方美观，屏幕效果好，运行速度快，存储空间对老人来说已经很充足。,5
外形外观：很好，颜色还很喜欢运行速度：运行速度很快，下载差不多是几秒钟就搞定。,5
外形外观：很棒屏幕音效：好拍照效果：清晰运行速度：快待机时间：长其他特色：长得不错,5
整体感觉很好，很喜欢这个颜色，6G运行，配64G内存，速度杠杠的，反应超快，物流也快，比预计时间早到两天，很满意，好评,5
手机很好看，看起来很上档次用起来触屏灵敏，6GB的果然快。,5
这是在京东上买的第5个手机了，京东上的东西就是不错，尤其是客服非常棒，有什么疑惑的问题直接问，回复非常快，喜欢这样的氛围，这就是我喜欢在京东上买东西的原因。手机非常好，值得大家信赖，在京东买好货，喜欢的就直接下单,5
流畅的机身，炫酷的外观，独一无二的设计，绝佳的手感，强悍的性能，超高的配置，设计师的独具匠心使我这个消费者超高的购物体验，搭配微柔的客服，极速的快递这是一次绝佳的购物体验,5
手机非常漂亮，运行速度非常快，电池待机时间很长，拍照效果和屏幕像素都刚刚的！客服态度诚恳，是一次非常满意的购物，谢谢！,5
收到马上试用了，反应流畅，色彩好看，妈妈很喜欢，有需要还来买,5
质量还可以我这是二次购买了，第一次买的小孩用的非常满意，这次又给小孩买了一个。物流快不到24小时就到了,5
买给老年人用的，很好，运行快不卡，颜色选择也多，总之，好评,5
这个手机非常流畅，像素也不错，而且是水滴屏幕，适合女性使用，是一次性价比非常高的手机，玩游戏也很好，王者荣耀没问题，不错不错,5
很漂亮，反应很快 买给妈妈用的 很喜欢,5
外形外观：外形大气。屏幕音效：音质清晰，有动感的感觉。拍照效果：清晰度很高。待机时间：正常使用待机超过72小时，打破苹果一天一充。,5
这款手机真的很棒，去年买了两个自己用，觉得很好，这次给爸爸买的，价格非常划算，比去年自己买的便宜了五百多。,5
真的很不错诶，第一次网购买手机，必须要给五星好评，那些说的赠品也都有，而且还额外多了一个钢化膜，真好，以后会继续关注这家店铺的，希望你们越做越好,5
很精致，客服服务态度好，有任何问题都帮忙解决了！,5
手机颜色非常好看，运行也很流畅，两千不到的全面屏，性价比可以说是非常的高了，真的很喜欢，唯一不太完美的是后置指纹，个人更喜欢前置指纹或者屏内指纹，但价位不够也不能要求过高。发货特别快，第三天就到了,5
很快，因为我妈妈也用这手机，看见外婆也想用智能机，就买了,5
外形外观：好看待机时间：长屏幕音效：正运行速度：非常快拍照效果：非常清晰,5
手机运行完美   比骄龙660强一些 ！电池续航没毛病！服务很满意！吃鸡无卡顿！第一把直接吃鸡！换手机的！也别买贵的！先买这个用！等5G出来再换！,5
手机很不错，待机时间很长，玩游戏也不卡，是我想要的那种,5
外形外观：比较时尚屏幕音效：感觉好拍照效果：非常好运行速度：可以待机时间：可以，只要不是玩游戏其他特色：感觉非常好，毕竟价格合适，质量不错。,5
手机收到了 很满意 好喜欢 又实惠 比较适合老人用 喜欢的宝宝们赶紧下单 而且还送一年的影视VIP,5
手机给女儿买的，她非常喜欢，说上网速度快，一点都不卡，我家手机都在京东买，这是第六个了，认准京东。,5
开心愉的一次购物，手机上网快而不卡，我们一家全在京东买的华为，京东买手机放在心。,5
老板超级棒 30下单 31号就到了 年前老人用上了新手机??,5
手机收到了 非常喜欢 款式好看 质量好 运行速度快 打游戏时一点不卡 像素非常好 物流超快,5
给婆婆买的，挺流畅的，老人用挺好，功能也都很齐全,5
这个颜色是真的好看，颜值逆天，配我。手机运行速度很快，跟我之前的旗舰机差不多，手感很好。物流好快第二天就到了，卖家还赠送了很多小礼物，感谢,5
外形外观：很适合买给父母屏幕音效：同价比绝对高拍照效果：很ok待机时间：很长运行速度：老年人用着绝对没问题,5
买给父母的，绝合适，没问题，很ok,5
手机用着还可以，我也不玩游戏，够用就好，这款性价比还是很高的。,5
很好，颜值也挺好的，给孩子买的，她挺喜欢的，送的东西也很多,5
这个手机非常的棒，非常的好，太满意了，快递员了非常的热情，直接给我送到家里了，还顺便给我把垃圾带了出去，谢谢,5
手机整体感觉不错，外形和颜色都喜欢，开机很流畅，打手游完全没压力。很喜欢,5
手机收到了，外观很漂亮，大小合适，商家还送了一个保护套，很好看，上档次，打游戏超级好，非常满意,5
外形外观：很好看运行速度：很快，玩几个大内存的游戏没问题,5
收到宝贝很喜欢 手机很好  很愉快的一次购物,5
很喜欢，帮家里人买的，外形和颜色都喜欢，开机很流畅，视频看起来也很不错,5
这个颜色很漂亮，超赞，很喜欢。使用很流畅，屏幕清晰。物流很快，客服很热情，问什么都回答，以后买手机就这家了。,5
很漂亮，大小也合适，送保护套，膜贴了一个，但不是钢化膜。可以把字体调很大，老人家看起来也很容易。运行速度也很快，不过也还没安装很多软件，送给家里老人，目前一切满意。,5
手机不错 时尚大气 运行也不错 玩游戏很顺畅,5
很漂亮，拍摄图像很清晰，还未用，不知质量如何，但还是很喜欢。,5
已经收到在用，反应非常快，内存足，拍照也非常清晰，非常满意特别喜欢,5
手机外观很好，手感也好，功能较多，很好使用，配送的东西很贴心，给五星！,5
手机很喜欢  颜值很高  像素也不错  最关键的是价格还便宜,5
外形外观：很好看运行速度：很快，玩几个大内存的游戏没问题,5
收到宝贝很喜欢 手机很好  很愉快的一次购物,5
很喜欢，帮家里人买的，外形和颜色都喜欢，开机很流畅，视频看起来也很不错,5
这个颜色很漂亮，超赞，很喜欢。使用很流畅，屏幕清晰。物流很快，客服很热情，问什么都回答，以后买手机就这家了。,5
很漂亮，大小也合适，送保护套，膜贴了一个，但不是钢化膜。可以把字体调很大，老人家看起来也很容易。运行速度也很快，不过也还没安装很多软件，送给家里老人，目前一切满意。,5
手机不错 时尚大气 运行也不错 玩游戏很顺畅,5
很漂亮，拍摄图像很清晰，还未用，不知质量如何，但还是很喜欢。,5
已经收到在用，反应非常快，内存足，拍照也非常清晰，非常满意特别喜欢,5
手机外观很好，手感也好，功能较多，很好使用，配送的东西很贴心，给五星！,5
手机很喜欢  颜值很高  像素也不错  最关键的是价格还便宜,5
手机很不错，很快，不卡，电池耐用，支持国货,5
手机收到了，速度非常快，屏幕分辨率很高，很喜欢！,5
很不错呦，物流也很快，手机已经用过啦，感觉可以是喜欢的样子，也很流畅颜色也很漂亮，开心??,5
手机到了体验很好，东西很全，客服态度很好，体验卡的问题都解决了。,5
