comment,score
外形外观：很好看屏幕音效：音质很清晰拍照效果：拍照非常清晰运行速度：一个字快待机时间：时间长,5
谢谢老板，货真价实，真好用,5
是我喜欢的黑色 用的很顺手 待机时间长 电池很经用,5
手机很好用外观大小都挺合适，服务超级好，,5
发货快，收到手机很漂亮呀，反应快很喜欢，店家还送了小风扇跟蓝牙耳机那些，送的都特实用。下次有需要再来，认准华为?,5
手机很漂亮，性能也不错，拿来送给对象的生日礼物，她很喜欢！,5
很好。客服热情，耐心。送了不少东西。一直在这家买东西！,5
外形外观：大气漂亮屏幕音效：清晰拍照效果：好运行速度：快待机时间：未知其他特色：满意,5
外形外观：手机很漂亮屏幕音效：屏幕大音质不错拍照效果：拍照清晰运行速度：运行速度快,5
整体运行不错，选的黑色，颜色沉稳，价格也不贵，很合适,5
外形外观：很好看屏幕音效：音质很清晰拍照效果：拍照非常清晰运行速度：一个字快待机时间：时间长,5
谢谢老板，货真价实，真好用,5
是我喜欢的黑色 用的很顺手 待机时间长 电池很经用,5
手机很好用外观大小都挺合适，服务超级好，,5
发货快，收到手机很漂亮呀，反应快很喜欢，店家还送了小风扇跟蓝牙耳机那些，送的都特实用。下次有需要再来，认准华为?,5
手机很漂亮，性能也不错，拿来送给对象的生日礼物，她很喜欢！,5
很好。客服热情，耐心。送了不少东西。一直在这家买东西！,5
外形外观：大气漂亮屏幕音效：清晰拍照效果：好运行速度：快待机时间：未知其他特色：满意,5
外形外观：手机很漂亮屏幕音效：屏幕大音质不错拍照效果：拍照清晰运行速度：运行速度快,5
外形外观：酷炫屏幕音效：质感拍照效果：很赞运行速度：超快待机时间：持久其他特色：奈思,5
拍照效果：拍照效果很好，特别喜欢夜景模式里面拍的照运行速度：流畅不卡顿,5
手机用着很不错，系统流畅，反应快，外观也大气好看,5
外形外观：挺好看的，给朋友买的当时就挑中了这个色，发回来跟图片效果基本一致音效和拍照效果都不错，物有所值运行速度良好，打游戏没压力。待机时间也ok赠品挺多的。手机和赠品分两次发的当时不知道还问了客服，客服服务非常好，后来发赠品漏发了一个蓝牙耳机，联系客服客服也很快处理了。等到收到后再来追评嘻嘻反正在这个价位来讲感觉非常不错了，物有所值啦，推荐购买。,5
屏幕音效：清晰，特别棒拍照效果：很好运行速度：快，现在家里没有5G相信有了会更棒,5
整体来说，比较满意的一次购物，一时冲动就下单了，客服和快递都很给力！收到货以后不会贴钢化膜，不会使用手环，客服都耐心的解答了！很满意,5
刚收到手机，一直使用华为，拍照清晰，开关机待机短，运行速度很快，配套齐全，客服小姐姐很耐心很专业。,5
漂亮内存很大，用起来一点也不卡，超级快，真的是国产机中的战斗机呀，非常满意。,5
手机真的很好用，颜色也特别满意，比苹果手机好用，棒棒哒,5
待机时间长，运行速度快。拍照效果好。非常棒，满意好评。,5
外形外观：高端大气上档次运行速度：没有卡顿，速度很流畅其他特色：性价比超高,5
买到款心仪的手机，心情都很好，打游戏吃鸡毫不费劲，特别满意，觉得买的值,5
拍照清楚，音质很好，上手效果不错，王者吃鸡完美运行,5
手机收到了，物流很快，外观很好看网速也快，拍照很清晰，非常满意,5
买来送朋友的，真是非常棒，朋友反馈特别好，说系统特别流畅，打游戏一点都不会卡顿，非常好。,5
终于买到心仪的手机了，屏幕大小适中，运行也很流畅，国货精品。,5
宝贝已收到质量很好外形外观：外形很好看运行速度：运行速度点,5
手机用起来很流畅，打游戏手感好，体验好久才评价的，放心购买,5
手机拍照效果不错，很清晰。运行速度很快，很满意。,5
华为最新7系列，老妈很喜欢配置高，颜值棒，很不错,5
手机很舒服 支持5G 刚刚好我这可以用 反应很快,5
运行速度流畅，音质好，拍照效果好。颜色很正是正品，值得入手。,5
手机收到了，好喜欢这款这个手机给五星好评。拍照效果：拍摄效果不错！,5
外形外观：酷炫拍照效果：清晰 像素高运行速度：很快待机时间：长,5
手机真是超级棒，一直都支持国产，特别喜欢华为手机，对比了好多家以后还是选择了这里，手机质量有保证，从售前到售后的服务态度都非常棒，买的很满意,5
外形外观：好看不错屏幕音效：很喜欢其他特色：很快上手拍照效果：果很好,5
屏幕音效：很喜欢拍照效果：很好运行速度：快其他特色：好待机时间：长,5
外形外观：非常试用，送的无线耳机也很不错。,5
帮家里边的长辈购买的，以前也在这家店购买过手机，质量方面都有保障，售后做的也很优秀，这次也毫不犹豫的选择了这家，买的放心。,5
买给爸爸用的，是正品，还送了一堆小礼品，客服也很负责，送的钢化膜边边裂了一点点，给我又寄了两个钢化膜过来，满意,5
外形外观：简单易操作，颜色漂亮。屏幕音效：能对付日常的所有需求。运行速度：对于一款千元以内的机器，性价比很不错了。待机时间：充满电正常使用一天没问题,5
外形外观：很漂亮，妈妈很喜欢。屏幕音效：还不错，够用。拍照效果：还没测试。运行速度：很快。待机时间：还没测试,5
外形外观：好漂亮啊！好喜欢。小仙女最适合这款手机了。屏幕音效：屏幕很好，音质也好，反正就是什么都好??拍照效果：AI智能拍照，4800像素非常清晰，相机我超爱了，随手拍你就是国际摄影师?运行速度：虽然我卖的是4G的，但是也不差到哪啊待机时间：待机时间也是很长时间的，充电器你充一下就满了。反正我就是很喜欢很喜欢这个手机。爱了爱了。而且还真送很多东西。Very good??Nice这款手机小仙女必备哟,5
荣耀20青春版4+64的，920元入手，配置后摄四千万加前摄1600万的像素在这个价位很香了，而且机身很薄，手感特别好，除原装配件以外还赠送了一副耳机（虽然不是原装的但日常使用也可以）和一根数据线还有指环扣，很给力了，用了一个月才来评论，使用很流畅无卡顿，强烈建议购买。就是系统版本有点旧，还是9拍照效果：同价位很好运行速度：流程外形外观：薄而精致,5
拍照效果：摄像头超级清晰屏幕音效：显示很细腻很清楚外形外观：漂亮的没话说运行速度：很快的，足够用了待机时间：一天没问题,5
外形外观：和实物一样，没有差别，屏幕音效：非常满意，音质不错，值得赞美，音量可大，挺满意的。拍照效果：清晰完美，功能也很实用。拍照美美的。运行速度：4g运行，也能满足我平时使用了，也不卡。足够了。待机时间：常待机 2天没撒问题，可以了。其他特色：看了很多个平台，还是店家的东西，实惠。,5
外形外观：可以屏幕音效：很好拍照效果：拍下的照片很好看运行速度：可以，玩吃鸡不卡，我快上王者了待机时间：很多快其他特色：这特色很好，很喜欢,5
之前的手机不中用了，看来看去选择了这款手机，价钱便宜，看到评价比较高，买了之后，送货很快，第二天到手，用了三天后才来评价的，确实性价比较高，一千元的手机能有这样的配置和颜值还是很好的，反应快，而且还是屏幕指纹锁，很实用！！,5
外形外观：漂亮屏幕音效：非常好拍照效果：好运行速度：快，给力待机时间：长其他特色：颜色给力,5
外形外观：精致运行速度：非常快其他特色：饱和度太高了屏幕音效：都没的说,5
外形外观：简单易操作，颜色漂亮。屏幕音效：能对付日常的所有需求。运行速度：对于一款千元以内的机器，性价比很不错了。待机时间：充满电正常使用一天没问题,5
外形外观：很漂亮，妈妈很喜欢。屏幕音效：还不错，够用。拍照效果：还没测试。运行速度：很快。待机时间：还没测试,5
外形外观：好漂亮啊！好喜欢。小仙女最适合这款手机了。屏幕音效：屏幕很好，音质也好，反正就是什么都好??拍照效果：AI智能拍照，4800像素非常清晰，相机我超爱了，随手拍你就是国际摄影师?运行速度：虽然我卖的是4G的，但是也不差到哪啊待机时间：待机时间也是很长时间的，充电器你充一下就满了。反正我就是很喜欢很喜欢这个手机。爱了爱了。而且还真送很多东西。Very good??Nice这款手机小仙女必备哟,5
荣耀20青春版4+64的，920元入手，配置后摄四千万加前摄1600万的像素在这个价位很香了，而且机身很薄，手感特别好，除原装配件以外还赠送了一副耳机（虽然不是原装的但日常使用也可以）和一根数据线还有指环扣，很给力了，用了一个月才来评论，使用很流畅无卡顿，强烈建议购买。就是系统版本有点旧，还是9拍照效果：同价位很好运行速度：流程外形外观：薄而精致,5
拍照效果：摄像头超级清晰屏幕音效：显示很细腻很清楚外形外观：漂亮的没话说运行速度：很快的，足够用了待机时间：一天没问题,5
外形外观：和实物一样，没有差别，屏幕音效：非常满意，音质不错，值得赞美，音量可大，挺满意的。拍照效果：清晰完美，功能也很实用。拍照美美的。运行速度：4g运行，也能满足我平时使用了，也不卡。足够了。待机时间：常待机 2天没撒问题，可以了。其他特色：看了很多个平台，还是店家的东西，实惠。,5
外形外观：可以屏幕音效：很好拍照效果：拍下的照片很好看运行速度：可以，玩吃鸡不卡，我快上王者了待机时间：很多快其他特色：这特色很好，很喜欢,5
之前的手机不中用了，看来看去选择了这款手机，价钱便宜，看到评价比较高，买了之后，送货很快，第二天到手，用了三天后才来评价的，确实性价比较高，一千元的手机能有这样的配置和颜值还是很好的，反应快，而且还是屏幕指纹锁，很实用！！,5
外形外观：漂亮屏幕音效：非常好拍照效果：好运行速度：快，给力待机时间：长其他特色：颜色给力,5
外形外观：精致运行速度：非常快其他特色：饱和度太高了屏幕音效：都没的说,5
这款手机拿到手手哈特别好，薄薄的，也不沉，主要是给老人用的。不要求功能特别多给一个要求手感舒适，方便实用，老人很喜欢。,5
外形外观：非常喜欢，图片上面看起来像绿色，实际看是蓝色，带一点点绿色的感觉屏幕音效：特别喜欢屏幕指纹运行速度：打游戏基本没问题其他特色：20W快充特别喜欢待机时间：感觉电池不怎么经用，大概一天得三充总体来说还是非常不错的，满意，不到一年前买的荣耀play3，高价低配的手机，不说了，抱着手机睡觉去了,5
手机很好看，给妈妈买的，她很喜欢，用了几天来评价一下，指纹解锁很有趣，很好用无异常画质不错，音质也很好，流畅，反应迅速，照相也不错，很清晰，充电也很快，待机时间长。,5
打开眼前一亮，手机颜色配色很漂亮，屏幕比较细长，刚好可以单手操作，非常方便顺手，音效也非常的舒服，可惜没有官方的耳机，不带耳机。。拍照效果清晰，有多种拍照模式，运行速度还是很快的，待机时间要等用段时间再来评价了。,5
很满意，大电池，待机久，快充，缓解电池焦虑症，全面屏，大气，音效也不错。还带屏下指纹和人脸识别，人性化，老爸很开心。,5
给妈妈买的，她很喜欢，外观也很漂亮，拍照效果也不错，运行速度也快，待机时间也长,5
屏幕音效：屏幕显示真清晰拍照效果：镜头清晰亮丽外形外观：做工很精致运行速度：新机器运行很流畅待机时间：一天了，用了一半的电,5
此用户未填写评价内容,5
很棒的一次购物，晚上下单，第二天早上就到了。打开一看，很满意。给老妈用的，把里面不用的app全部删除干净了。手机很漂亮，运行速度也是非常的快，充电也很快，本来看中9X，但手机太大了，这个手机差不多，价格也很实惠，屏幕下指纹很好用，刷脸也很棒。为了防止误刷，把刷脸删除了，就留下指纹，很好看就是了。,5
外形外观：很好看屏幕音效：还可以拍照效果：还不错运行速度：还可以,5
外观很漂亮，手感很好，是一款性价比不错的手机。,5
我收到了立马拆开看。真的是超级喜欢的。很好用，也很好看。拍照清晰，声音大，一点都不卡,5
外形外观：漂亮大气屏幕音效：非常满意拍照效果：清晰运行速度：快待机时间：长其他特色：一个字，好,5
外形外观：看起来很漂亮，颜色高端屏幕音效：好拍照效果：清晰运行速度：流畅待机时间：长性价比很高的手机。,5
拍照效果：特清晰外形外观：薄，轻，喜欢待机时间：孩子上网课连用两天哦运行速度：很快,5
手机很漂亮，给公司买了个手机。我感觉挺好的♥,5
外形外观：漂亮屏幕音效：很好拍照效果：清晰运行速度：比以前手机多了待机时间：好,5
外形外观：相当高，非常好看运行速度：不错，主要是老人用，已经很快了,5
外形外观：外型美观拍照效果：素很好 运行速度：网络流畅待机时间：满格电光打接电话，能用三天。,5
给家里人用的，华为相信华为的品质，就是华为的手机找回功能真的跟鸡肋！！,5
先给好评吧，感觉还行，用得好过后再来追评吧，这已经被列入我的无限回购清单！发货速度非常快！,5
物流很快，手机工艺不错，运行速度也还行，如果你还是学生可以考虑一下,5
外形外观：漂亮，美观很满意。拍照效果好，运行速度快。十分满意。,5
我还想买部。,5
外形外观：很漂亮屏幕音效：很好运行速度：完全可以满足日常工作,5
我妈特别喜欢，总之我妈喜欢那就应该很不错了吧，实物我没见到，但是我妈很开心。一直买华为，家里所有人都用的华为，品质不错。,5
非常好操作，按照它的提示就把这个手机激活了，现在的华为手机还是很不错的样子很像苹果。?,5
手机不错，卖家送的东西也很实在，值得购买,5
用了几天不卡顿没任何毛病，值得购买的产品，送的东西也没毛病，想买的赶紧下手吧！,5
不错，屏幕也很好，音效也非常好，拍照像素比较高，可以达到自己的预期,5
很适合学生用，有下载安全锁，不错上网课用,5
这此卖的东西质量好，配件齐全价格合适值得拥有，小孩非常喜欢值得推荐！,5
便宜实惠，很好看，性能稳定可靠^_^^_^^_^^_^,5
买给老人家的，很喜欢，外观漂亮，送货速度很快,5
屏幕音效：很清晰，流畅拍照效果：挺清楚外形外观：板正,5
还不错点个赞外形外观：我妈妈觉得大了，本人觉得很好,5
外形外观：简单大气，拍照效果：4800万像素，拍照很清晰,5
运行速度：很快，满意，还在犹豫的可以下手，,5
买给老爸的，看上去很不错，用着也听好。。,5
外形漂亮，运行很快，女儿很喜欢,5
物流很快，货收到很满意,5
外形外观：手感不错运行速度：一般软件也很流畅,5
外形外观：非常不错   给老爸买的  很喜欢,5
挺好用的，手机很漂亮，运行速度很快,5
外形外观：好看，很薄，爸爸很喜欢,5
手机跟我期待的一样，外观很漂亮，拍照很清楚。,5
美观  时尚  好用  超喜翻,5
手机用了几天没问题，很好玩的一个手机,5
手机很好看，给妈妈买的，她很喜欢，用了几天来评价一下，指纹解锁很有趣，很好用无异常画质不错，音质也很好，流畅，反应迅速，照相也不错，很清晰，充电也很快，待机时间长。,5
收到啦，手机包装很漂亮！会复购哦,5
物流很快！手机对得起这个价位，不多评论?,5
价格实惠，实际手感很好，速度快,5
东西很好外形外观：外形很靓，很炫,5
整体效果不错，老人很满意,5
外形外观：很漂亮运行速度：值得这个价钱,5
很好      舅舅很喜欢,5
给老爸买的，挺喜欢，很潮流,5
是买给妈妈用的，收到她很喜欢,5
很不错呢，很好用呢。,5
买给妈妈的，特别喜欢,5
运行速度：挺不错的，非常好,5
手机拿到手了   正品   原封  店家服务很周到,5
手机很好看 妈妈很喜欢,5
不错，屏幕也很好，音效也非常好，拍照像素比较高，可以达到自己的预期,5
手机很好看，给妈妈买的，她很喜欢，用了几天来评价一下，指纹解锁很有趣，很好用无异常画质不错，音质也很好，流畅，反应迅速，照相也不错，很清晰，充电也很快，待机时间长。,5
手机很好看，给妈妈买的，她很喜欢，用了几天来评价一下，指纹解锁很有趣，很好用无异常画质不错，音质也很好，流畅，反应迅速，照相也不错，很清晰，充电也很快，待机时间长。,5
拿到手里给我的第一印象就是轻薄（170多g）手机后置摄像头采用三射组合（4800w+800+200）前置摄像头1600w，能满足我的日常需求 ，好评在就是屏幕是指纹解锁，用起来很方便，解锁速度也很快，手机搭载的是麒麟710F处理器，日常没问题，毕竟我不打游戏。搭载4000毫安大电池还有20w快充，一天够用。,5
给老妈买的，说是旧手机不好用了，看着华为的还不错，就给她定了了，老妈还挺喜欢的。,5
家里第三部华为系手机了，手机本身没问题，店家赠品也挺不错，大大点赞！物流配送京东一如既往的给力！,5
外形外观：外观漂亮屏幕音效：声音一般，音质还可以，拍照效果：还没使用运行速度：用了再评论待机时间：用了一段时间再说其他特色：保护色和光线一般，,5
手机收到了感谢快递小哥送货上门，辛苦了！手机质量好，声音大，给老人买的，他也喜欢！,5
用了2天，手机还可以！,5
送给妈妈使用的，母亲节礼物?。用起来还不错，妈妈之前一直用按键的老人机，逐步让她使用智能机，爱上智能机。信赖华为！,5
外形外观：挺好看的。屏幕音效：还可以。拍照效果：很好。运行速度：一般般。待机时间：差不多。其他特色：不支持反向充电。，有点心痛,5
包装防震，配送服务好，手机刚拿到，还没激活哈，屏幕大，颜色洋气，谢谢，满意！,5
外形外观：外观炫酷！屏幕音效：音效其实还好。拍照效果：还没试过运行速度：可以，不卡顿。待机时间：还没试过,5
外形外观：给老人买的，收到了还没使用，外观看着还不错,5
外形外观：对外观要求不高，屏幕音效：还可以，手感不错，拍照效果：要求不高，够用,5
运行速度：快外形外观：漂亮屏幕音效：清晰拍照效果：不错其他特色：好看待机时间：可以,5
手机发货快，运行也还可以，现在的千元机基本都差不多,5
拍照效果：好运行速度：快外形外观：凑合,5
外形外观：还可以老人用起来完全够用了,5
不错  用啦一段时间啦  挺好的,5
外形外观：好看实惠耐用，拍照清晰,5
字大，老人用的顺手！,5
还不错，使用一段时间看看,4
给孩子买来上网课的，挺好,5
性价比高，外观设计都好！,5
手机是真品，老爸挺喜欢,5
还可以，买来家长用的,5
拍照效果：好运行速度：快外形外观：凑合,5
外形外观：还可以老人用起来完全够用了,5
不错  用啦一段时间啦  挺好的,5
外形外观：好看实惠耐用，拍照清晰,5
字大，老人用的顺手！,5
还不错，使用一段时间看看,4
给孩子买来上网课的，挺好,5
性价比高，外观设计都好！,5
手机是真品，老爸挺喜欢,5
还可以，买来家长用的,5
手机到了，暂时没发现有什么问题,5
刚拿到喔,5
好好好外形外观：好好好,5
手机不错家人非常喜欢,5
手机很好，不错的购物。,5
东西不错，先用用看,5
很不错的一款手机,5
给老妈买的，很喜欢,5
手机运行速度快,5
外形外观：很漂亮,5
挺好  性价比挺高,5
外形外观：很好看,5
外观漂亮，但未用,5
不错，老人很喜欢,5
很好孩子很喜欢,5
不错，五星评价,5
外形外观：好看,5
外形外观：很好,5
外形外观：舒服,5
外形外观：很好,5
满意，非常好,5
很好很不错,5
手机挺好用,5
好，很好，不错！,5
总体不错,5
手机不错,5
不错，好用。,5
非常好用,5
物美价廉,5
不错，好评！,5
手机美观好看大气，网络非常的快，拍照效果也好，音效功听，没有混音，待机也长，电耐用，好用,5
外形外观：背面在光线下是渐变的色彩，比想象中好看很多屏幕音效：屏幕很清晰，听歌质感很不错拍照效果：拍照效果真的不错，尤其是夜拍模式，很清晰，应该应用了AI技术，整个环境提亮了待机时间：待机时间还行到手有段时间了，主要是最近太忙，没时间来评论。买给我妈用的，她看过后很喜欢！店家也很实在，送了好多小赠品！,5
商家讲信用，自拍杆、耳机、手环、钢化膜等赠品一件不少，物流很快；使用了好几天周，效果杠杠的，手机充电速度很快，用到百分之三十几充电半个小时就充满了，非常满意的一次网上购物。,5
待机时间：荣耀的电池续航能力一直很好运行速度：很快，对得起这个价位，很强大外形外观：第一次换颜色，骚绿真舒服拍照效果：我对拍照要求不高，效果很好。屏幕音效：屏幕挺好，音效不敢恭维。荣耀的音效一直秉承着能听个响就好。其他特色：安兔兔跑分34.9万，性能模式开启跑分38.7万，对我来说太够用了。电源键吐槽一下，是真划手啊，好像上面贴了个硬纸片一样。都怕哪下给刮掉了。,5
手机收到了，买给妈妈用的，颜色很好看，妈妈也很喜欢。很流畅，内存也足够。物流也很快。外观妈妈也很喜欢，而且价格实惠值得推荐。,5
外形外观：外观满意拍照效果：非常棒运行速度：很快，满意其他特色：商家讲信用，自拍杆、耳机、手环、钢化膜等赠品一件不少，物流很快，一天到货；使用了一周，效果杠杠的，非常满意的一次网上购物。,5
外形外观：很漂亮。屏幕音效：非常好，性价比很高。拍照效果：非常清晰。远距离拍出来效果都很好。运行速度：很快很满意。待机时间：不玩游戏的话，用个两三天问题不大。其他特色：手机质量很好，很流畅。运行速度也很快。现在用的是4G网络的卡，很满意。,5
拍照效果：相机相素高，拍照清晰。运行速度：运行速度快。外形外观：外观很漂亮，我很喜欢。待机时间：充电速度快，待机时间也长。屏幕音效：屏幕大，音质好。其他特色：价格实惠，店家服务态度好，物流速度快。,5
啊哈哈哈，对于一个学生党来说手机真的很好很爱电量够我打好几局王者都没有问题的  手机运行快像素好还有一个就是客服真的好好，有问必答为我解决所以难题啊哈哈哈嗯，赠品很多也是非常喜欢呢,5
拍照效果：清晰，广角效果很棒外形外观：靓丽，手感不错待机时间：待机时间长，快充真不是闹着玩的，美美哒运行速度：速度杠杠的屏幕音效：声音不错，清晰其他特色：颜色炫酷，漂亮,5
手机美观好看大气，网络非常的快，拍照效果也好，音效功听，没有混音，待机也长，电耐用，好用,5
外形外观：背面在光线下是渐变的色彩，比想象中好看很多屏幕音效：屏幕很清晰，听歌质感很不错拍照效果：拍照效果真的不错，尤其是夜拍模式，很清晰，应该应用了AI技术，整个环境提亮了待机时间：待机时间还行到手有段时间了，主要是最近太忙，没时间来评论。买给我妈用的，她看过后很喜欢！店家也很实在，送了好多小赠品！,5
商家讲信用，自拍杆、耳机、手环、钢化膜等赠品一件不少，物流很快；使用了好几天周，效果杠杠的，手机充电速度很快，用到百分之三十几充电半个小时就充满了，非常满意的一次网上购物。,5
