comment,score
物流非常快隔天到，手机手感超级好，5G网络快的一批、摄像头好看，性价比高、还送蓝牙耳机音响，贴膜，指甲剪，商家非常有心，好评,5
价钱特别划算,5
外形外观：颜值高  全面屏运行速度：快  其他特色：老婆很喜欢  包装很好，快递速度没的说，满意,5
手机刚收到   付完尾款第二天就收到了  物流没得说  很速度。收到就拆开试了下颜色外形很惊艳  运行也很流畅拍照清晰  功能强大    一直在用华为  支持华为支持国产。另外店家的服务很到位   客服态度也很棒  很满意的购物体验！,5
外形外观：很好看拍照效果：效果很好运行速度：特别流畅快递还特别快  炒鸡喜欢,5
外形外观：很喜欢这个颜色拍照效果：拍照很清晰手感不错，反应很灵敏，跟在实体店买，没啥区别，在网上买还有很多礼品送，大爱,5
外形外观：外观很大气，喜欢。拍照效果：拍摄效果很棒，支持国货，支持华为。运行速度：5G很快商家送了很多东西，很暖心，很实用的,5
用了这么多天才来评价的，手机很好用，一点儿也不卡，照相也清晰，老婆很满意这部手机。送的礼品也很好，特别喜欢那个蓝牙耳机。,5
第一次在京东买手机，真的很不错，外观很漂亮，而且拍照像素很好，手感也很不错，这次真的没买错呢，喜欢的亲不要犹豫了哦，这款手机值得入手哦，,5
外形外观：手机颜色，外观超级棒送的小音响也很酷，侧边指纹解锁也很舒服~,5
非常满意的购物，华为本来就是大牌子，手机质量没得说了，商家还赠送一系列配件，好评好评，目前40W快充是我体验过最快的速度了，把旧手机的材料克隆到新手机来，丝毫不影响新手机运行的速度，5G模式下用4G的卡上网速度比4G手机快多了！,5
这款手机外观大气，漂亮！且手感好！屏幕音效，拍照效果都非常理想与央视广告宣传相符！,5
地区稍微有点远，付款第三天早上就收到了，物流很给力，手机机型看着很好，使用也很流畅,5
外形外观：好看屏幕音效：挺好的拍照效果：不错运行速度：快其他特色：送了好多东西，手机也超好，用用再看，今天刚拿到，因为正在用无法拍照,5
外形外观：外形挺好看的拍照效果：拍照效果很好运行速度：今天用了一天，运行速度很快其他特色：还有很多赠品,5
这手机太赞了.屏幕很大.声音也大.手机性能也很赞.相机很清晰.这边抢到的手机.第二天就到了客服小姐姐也很热情.从京东买到的第一台手机。是真的很棒.,5
拍照效果：像素高，清晰屏幕音效：音质很好外形外观：高端大气运行速度：速度快待机时间：待机时间长,5
很新的机型 和预想的一样 很多华为的细节做的很好比如网络加速自动选择wifi或流量,5
太喜欢了。绝对不错的选择。保留追加评论权利。??,5
外形外观：外观大气屏幕音效：震撼音效拍照效果：4摄效果很棒运行速度：速度超快,5
外形外观：银色很正。屏幕音效：立体声很好，完全不像2千价位的拍照效果：很棒。很清晰运行速度：超级快待机时间：2天,5
外形外观：实物与图片一样拍照效果：非常清晰运行速度：非常快待机时间：够玩儿两天,5
这款手机很好用，家人都在用华为手机，我之前没用过，所以试一下，还真挺好的，拍照效果好，美颜功能也好，声音很大，下次再买一个给我妈妈用，因为老年人耳朵不好，这款声音大，刚好适合妈妈用，外观颜色我选绿色，很洋气，总之都比较满意,5
值得信赖，支持国产。外形外观：漂亮拍照效果：非常好待机时间：长运行速度：可以,5
外形外观：很好屏幕音效：非常好拍照效果：非常好运行速度：特别快待机时间：时间长,5
手机非常好，和介绍上一样，手机买回来就用，非常快，非常满意，谢谢,5
外形外观：颜色漂亮，手感顺滑，操作特别流畅，华为真的挺用心的！赠品也很多,5
屏幕大小合适，速度很快，操作简单，外观也很好，不错的一次购物,5
外形外观：外观好看，大气手感很好屏幕音效：音效棒棒哒拍照效果：拍照很清晰，效果非常好运行速度：非常快待机时间：待机时间很好其他特色：都很满意,5
手机的配色真的爱了，而且很轻，运行也很流畅，还送了很多东西,5
外形外观：刚收到还没开始用给妈妈买的 颜值很好看银色适合女生 手机轻巧 像素还超棒呢 待机功能还不知道 试了一下音质还不错 总体不错比较满意,5
手机好用，运行速度和拍照效果都很好，而且赠品多多！我很喜欢,5
运行速度：非常快拍照效果：很清晰屏幕音效：很响外形外观：特别好待机时间：很长其他特色：什么都好,5
外形外观：非常漂亮，拿着很舒服。屏幕音效：非常好，音质也很好拍照效果：特别清楚，待机时间：待机时间长运行速度：非常快，玩游戏也很流畅。,5
外形外观：非常漂亮 大小合适屏幕音效：屏幕柔和 音效理想拍照效果：拍照非常好运行速度：速度非常快待机时间：电池耐用,5
手机很好  玩游戏完美运行  不掉帧  拍照效果非常棒  力挺国货,5
手机不错? ，送的东西特别好，蓝牙小音箱，用着美美的。客服态度特别好。。,5
用了三天天了，感觉很好用。很喜欢。手感好。,5
拍照效果：拍照的效果很好运行速度：运行还可以哦，试玩了一下不卡,5
手机挺好的，客服态度也挺好，拍出来的照片清晰，手机的颜值很高，太漂亮了本来想送人的，自己用了? ，而且拿回来找朋友一查，正品没问题，赠品又好又多，以后就认准他家了，棒！,5
手机很漂亮哦  物流也很快   手机触感也很好   灵敏运行又快   而且充电超快哦,5
手机很不错，是2020年4月才出的新机子，性价比很高，玩起来挺快的，买给老公用的，老公很满意，电量很足，充电一小时就可以满，希望内存不要那么快满，满分好评啦！,5
外形外观：很不错，大小合适屏幕音效：正常拍照效果：很棒，6400万像素比我原来的好不少运行速度：极致流畅，应用间切换看不到卡顿待机时间：优秀，能支撑一天所需（使用量较大）,5
第N个华为手机了，外观性能都很满意，关键老板特别大气，送了很多礼品，蓝牙耳机蓝牙音响，指甲刀套装，比在自营上面的赠品给力多了,5
昨天收到货了，目前感觉非常满意。我们工公司也是做手机的，从各方面看，这手机做工很到位。,5
外形外观：可以屏幕音效：非常喜欢拍照效果：清楚运行速度：快待机时间：很长其他特色：特别喜欢他的快充,5
手机不错挺好的，快递速度挺快的，客服的服务态度也不错运行速度：非常棒,5
外形外观：外观挺好看，姐姐非常喜欢待机时间：打游戏可以的,5
外观很好看，试了下，运行速度很快，拍照效果不错?,5
外形很满意  用的很快，不卡，精致，赠送了那么多东西  很好,5
运行速度：很流畅，挺好的拍照效果：很清晰，这价位可以的了外形外观：是我喜欢的颜色待机时间：一天时间没问题！,5
手机用了两天才过来评论，手机很好，反应快，电池也挺耐用，主要是手机的性价比，反正想买手机的，可以考虑一下这款。好评,5
运行速度：很快拍照效果：很美，很稳定，比较漂亮外形外观：线型美，高端大气上档次,5
外形外观：颜色美爆了，大小也ok拍照效果：必须得说下他的拍照效果，所有我用过的手机中拍照效果最好的一部，喜欢拍照的必须拿下他其他特色：店铺的客服不知道是小哥哥还是小姐姐，相当的有耐心，当时纠结买nova6还是这部，都给我非常详细的介绍，特别专业,5
外观好看，手感也好，妈妈生日给爸爸妈妈一人买一台，家里人非常喜欢，拍照效果好，运速超级快?,5
手机用起来真的很好 手感也挺不错 是我喜欢的手机类型 喜欢可以选择购买哦！,5
手机收到了，很好看，也很还用，是比较理想款，还送了很多东西。,5
一款性价比很高手机，卖家发货很快，第二天就到了，赠品也很丰富，品质也好，很满意！,5
不错，手感非常好。一次非常满意的网购,5
外形外观：大气屏幕音效：很好拍照效果：很好待机时间：很好其他特色：很好运行速度：运行速度流畅,5
寄件速度很快，服务态度也很好，手机已拿到，手感，外观，内置都很棒，没买错?我给我朋友介绍了,5
手机真心不错，屏幕大气，玩游戏手感极佳，拍张特别清晰，下次还来你家购物。,5
屏幕音效：清晰拍照效果：拍照效果特别清晰其他特色：好待机时间：长运行速度：快,5
外形外观：外观好看，精美运行速度：运行速度很好，非常喜欢这款手机！赞??,5
还可以的，充电超快，待机时间也很好，运行也行，不知道过段时间咋样，反正目前看来还不错,5
手机不错，打游戏一点都不卡，颜色也好看，最主要是颜色还很好看！,5
外形外观：很好拿着很舒服运行速度：新机运行很快待机时间：待机时间很长可以用一整天,5
宝贝收到了，反应快，颜值非常的高，拍照效果不错，非常值得购买。,5
拍照效果：很棒屏幕音效：好外形外观：好看运行速度：快待机时间：长其他特色：高级感,5
手机很好看 很喜欢      客服回复很快  态度很好  太喜欢了  手机性价比很高,5
其他特色：用了几天感觉很好用。也不会卡。考虑打游戏卡的游戏画质差的。不要犹豫了。直接买吧。赞赞赞赞赞,5
拍照效果：很好，运行速度：不错，外形外观：非常满意！,5
拍照效果：好其他特色：观 待机时间：超长运行速度：快 外形外观：高大上屏幕音效：好,5
刚刚到，物流很快，试了一下拍照效果也很好，还有小赠品，非常不错，价格也比较亲民，,5
对于我这个颜控来说  这款手机的颜值彻底征服了我  不  店家还送了好多赠品都很实用  好评,5
外形外观：外形好看屏幕音效：屏幕显示清晰，音效好运行速度：超快,5
使用体验感很好，性价比高，强烈推荐此款,5
外形外观：很漂亮屏幕音效：屏幕鲜亮，音效一级棒拍照效果：照片清晰,5
外形外观：好看屏幕音效：很好拍照效果：很好运行速度：还行待机时间：还行,5
待机时间：长运行速度：很好屏幕音效：可以拍照效果：挺好的外形外观：满意,5
手机还不错 拍照效果特别好颜色很好看，好评,5
包装很好，性价比高，值得推荐，还送好多礼品，很满意的一次购物。,5
手机收到了 很满意。物流很快。像素很棒。很喜欢，不错。好评,5
手机漂亮，送的东西也很多，华为，中华有为，不错！！,5
手机屏幕大，运行流畅，外表非常漂亮，超级喜欢。,5
商品很好，特别是赠品小音响小巧玲珑，颜色都非常喜欢,5
外形外观：很好屏幕音效：还没试拍照效果：很好运行速度：还可以待机时间：正在使用,5
用了两天了，各人手感我觉得还是很好用，,5
手机很有手感，样式新颖时尚，价格实惠,5
原以为颜色很深，但收到货后，颜色很喜欢,5
外形外观：外观很漂亮， 女朋友很喜欢，好评。,5
快递速度很快，东西很好，送的东西真多，大好几件东西！！！！,5
网速很快，很好，下次肯定快再来的。,5
手机非常好用，也不卡顿拍照效果非常oj8k,5
手机确实不错呀，性价比真的很高，支持店家哟，加油！！！！,5
商品很好，特别是赠品小音响小巧玲珑，颜色都非常喜欢,5
外形外观：很好屏幕音效：还没试拍照效果：很好运行速度：还可以待机时间：正在使用,5
用了两天了，各人手感我觉得还是很好用，,5
手机很有手感，样式新颖时尚，价格实惠,5
原以为颜色很深，但收到货后，颜色很喜欢,5
外形外观：外观很漂亮， 女朋友很喜欢，好评。,5
快递速度很快，东西很好，送的东西真多，大好几件东西！！！！,5
网速很快，很好，下次肯定快再来的。,5
手机非常好用，也不卡顿拍照效果非常oj8k,5
手机确实不错呀，性价比真的很高，支持店家哟，加油！！！！,5
手机收到了。还很喜欢的。送的东西也可以,5
手机收到了，非常好，正在使用，非常喜欢。,5
外形外观：外形很漂亮跟图片一样喜欢,5
给兄弟买的，他非常满意，月底再购一部，,5
发货很快，赶在520前送给老婆，棒棒的。,5
手机很好用太快了！5g棒棒哒,5
快递特别快，质量特别好。,5
绝对完美，谢谢客服姐姐,5
手机真的很不错哦，值得购买！,5
非常好用，而且很实惠！,5
手机太好了。速度很快,5
外形外观：华为就那几种颜色，可惜心爱的粉色没了屏幕音效：这个还行拍照效果：非常好，就是录像用的运行速度：非常满意待机时间：现在还不错其他特色：指纹识别改侧面了,5
外形外观：外观可以，挺不错的屏幕音效：正常，没有问题拍照效果：清晰运行速度：完美,5
收到手动挺不错，因不会手机搬家未使用，下次还会光临贵店购买产品！,5
外形外观：虽然颜色下错了，但是这个颜色也可以接受。。运行速度：更快，更稳定待机时间：手机到手三天了，几乎没怎么用，还有50%的电量。。其他特色：我就想问问能不能别搞这么多花里胡哨的。实实在在优惠点不行吗？？,5
手机收到已经用了两天了。手感不错，反应速度，像素都挺好的。那个快充挺给力,5
颜值高，速度快，照像效果对于我们这种不是很挑剔的来说没任何瑕疵。虽然5G还没有开通，但相信速度一定不会让人失望。,5
手机挺轻薄的。而且外观挺好看的，使用也比较顺畅，买给妈妈用 她挺喜欢的,5
运行速度：很快，，外形外观：大小合适屏幕音效：还好！没有发现不好的问题,5
手机真的挺好用的，还送好多礼品，手机的样式和手感也挺好，买了好几个都不送礼品，谢谢店家给送的礼品,5
待机时间：待机时间久！运行速度：速度好快.不比新版苹果速度慢不必新版苹果差！值得推荐！,5
用了几天 还不错 好用又实惠 推荐这家店,5
手机不错，物有所值，通话质量好。,5
屏幕音效：手机好用，不卡，拍照也清楚,5
手机收到了。外观完美，送的东西也挺多的，建议大家买，等用一下再看效果。,5
外观好看，屏幕高清，运行快。,5
其他特色：手机不错  家里第二台华为了 运行真是爽,5
让人意外惊喜，赠品多多，发货速度快,5
今天刚到，第一次用华为手机感觉还可以运行速度蛮快滴8G运行就是不一样其他的以后再追评？,5
外形外观：美屏幕音效：好拍照效果：清运行速度：快待机时间：长其他特色：赞,5
一直使用华为的手机，之前是用荣耀的手机，这次的nova5i感觉非常流畅，颜色也非常漂亮，入手的价格也很实惠，非常值得推荐。是给老爸买的，老爸的手机用了三年，也是华为的手机，老爸非常喜欢很开心，就算是父亲节提前送老爸的礼物。,5
很时尚大气的手机，颜值担当，孩子很喜欢。反应也很快，音质非常好，打电话很是畅通，运行速度好快！最重要的是经济又实惠，游戏无卡顿，一直在京东上购物，吃喝拉撒，衣食住行，学习资料和学习用品，基本上离不开京东，京东速度也是世界一流，希望京东越来越好！,5
外形外观：很漂亮拍照效果：超清晰图像拍摄运行速度：速度很快，很畅爽视频可能会显得模糊，但手机是很清晰的，很满意,5
外形外观：很漂亮拍照效果：清晰图像拍摄运行速度：速度很快待机时间：时间很长其他特色：手机很漂亮，家人都在用。,5
手机外形特别漂亮，是我喜欢的颜色，另外手机用起来也很顺畅，物有所值,5
好很好！机子很好！手感也没得说！国产大品牌！这配置这速度杠杠的，支持华为，没毛病外形外观：好得很屏幕音效：杠杠的拍照效果：没得说运行速度：欧力给,5
外形外观：常喜欢 屏幕音效：美 拍照效果：非常棒，这个价格也比较合理运行速度：以 待机时间：比较满意其他特色：音效还错,5
支持华为！颜色是老婆自己定的喜欢的颜色，外观感觉很时尚，系统运行非常流畅，当然新机都是这样，希望以后能一直保持这个姿势，内存是现在比较流行的8g＋128g，平时拍拍照刷刷视频网站是毫无压力了，4000毫安大电池待机时间非常满意，基本上两天一冲。,5
收到怏递打开包装，意外发现手机用空气袋包裹有效防护了手机摔打，可见商家考虑周详。手机制作工艺工整，一惯如华为严谨，开机显示色彩艳丽，此机为8十128配置，不到2000块钱，运行快速流畅，毫无卡顿，性价比之王手机。,5
华为手机值得每一位消费者和国人青睐。本机外形美观，反应很快，手感舒服。,5
一直使用华为的手机，之前是用荣耀的手机，这次的nova5i感觉非常流畅，颜色也非常漂亮，入手的价格也很实惠，非常值得推荐。是给老爸买的，老爸的手机用了三年，也是华为的手机，老爸非常喜欢很开心，就算是父亲节提前送老爸的礼物。,5
很时尚大气的手机，颜值担当，孩子很喜欢。反应也很快，音质非常好，打电话很是畅通，运行速度好快！最重要的是经济又实惠，游戏无卡顿，一直在京东上购物，吃喝拉撒，衣食住行，学习资料和学习用品，基本上离不开京东，京东速度也是世界一流，希望京东越来越好！,5
外形外观：很漂亮拍照效果：超清晰图像拍摄运行速度：速度很快，很畅爽视频可能会显得模糊，但手机是很清晰的，很满意,5
外形外观：很漂亮拍照效果：清晰图像拍摄运行速度：速度很快待机时间：时间很长其他特色：手机很漂亮，家人都在用。,5
手机外形特别漂亮，是我喜欢的颜色，另外手机用起来也很顺畅，物有所值,5
好很好！机子很好！手感也没得说！国产大品牌！这配置这速度杠杠的，支持华为，没毛病外形外观：好得很屏幕音效：杠杠的拍照效果：没得说运行速度：欧力给,5
外形外观：常喜欢 屏幕音效：美 拍照效果：非常棒，这个价格也比较合理运行速度：以 待机时间：比较满意其他特色：音效还错,5
支持华为！颜色是老婆自己定的喜欢的颜色，外观感觉很时尚，系统运行非常流畅，当然新机都是这样，希望以后能一直保持这个姿势，内存是现在比较流行的8g＋128g，平时拍拍照刷刷视频网站是毫无压力了，4000毫安大电池待机时间非常满意，基本上两天一冲。,5
收到怏递打开包装，意外发现手机用空气袋包裹有效防护了手机摔打，可见商家考虑周详。手机制作工艺工整，一惯如华为严谨，开机显示色彩艳丽，此机为8十128配置，不到2000块钱，运行快速流畅，毫无卡顿，性价比之王手机。,5
华为手机值得每一位消费者和国人青睐。本机外形美观，反应很快，手感舒服。,5
手机很好，外观漂亮，很轻，大小合适，反应很快，上网也好，越看越喜欢，价廉物美，性价比太高了，十分满意! 服务好，发货速度快!,5
外形外观：太喜欢这个颜色了  对这个颜色简直大爱呀拍照效果：拍照效果很清晰 完全够用 运行速度：我买的是8+128 正常使用应该没什么问题 刚到手 还在适应过程中 待机时间：电池容量还算比较大 按照我个人需求 24小时充一次点,5
第一次在网上买手机，手机性能很不错，画面也很流畅，运行速度很快外观设计也很好看,5
外形外观：首先线条流畅，用了几天，手感很好，另外内存是8+128的，足够用了，并且不到两千就能买到这样的内存，速度也很快，电池也很耐用，满意,5
外形外观：外观精美，讨人喜爱，耀眼夺目！！！屏幕音效：屏幕也很高清，画面显示非常细腻！！！音效也很不错，能震撼人心！！拍照效果：拍照很清晰，还带美颜，好评好评！！！！运行速度：运行速度很快，不会出现卡顿，这就是国货之光！！！待机时间：耐用，用一天完全没有问题！！其他特色：总结一句，国货之光！,5
外形外观：非常漂亮屏幕音效：有手感，很好拍照效果：特别清晰，美颜效果超级好运行速度：优秀待机时间：超长,5
外形外观：外观漂亮，很轻，大小合适运行速度：反应很快，上网也好，价廉物美拍照效果：拍照清晰待机时间：待机时间很长，充电速度也很快其他特色：买来给老妈用的，非常喜欢,5
收到马上开盒，相思红果然抢眼，机子的工艺一流，就是个艺术品。机的配置是最高的了，用起来是非常流程，性价比很好高。,5
收到手机很惊喜，期待很久果然没让我失望，手机外壳颜色很漂亮，手机功能很齐全，一打开就迫不及待的试用了一下，反应速度很快，相机拍的照片特别清晰，卖家还送了很多礼品，很实用，还有碎屏险，这样可以大胆放心使用了，人脸解锁特别方便，使用起来手感很不错，大屏幕可以慢慢追剧了，好评好评,5
外形外观：机身轻薄 屏幕大小适中 非常喜欢屏幕音效：色彩艳丽 音效也不错拍照效果：那是没的说 杠杠滴运行速度：8+128非常流畅 很久没体验这样酣畅淋漓了待机时间：充一次电  能用一天其他特色：黑色 大气 高端 上档次  这个价钱 买这种配置的 性价比简直就是超高 符合我的预期 谢谢,5
外形外观：非常完美很喜欢这个样式屏幕音效：屏幕够大，打游戏很爽待机时间：一天用下来还有30 %电量拍照效果：华为拍照效果很一流,5
很满意，这个手机挺薄的而且反应也挺好的   而且我最满意的是相机，颜色也很好，不错不错,5
操作挺快的，反应也很快，也非常的省电，充电速度挺快的，对于我来说，像素好就行了,5
外形外观：还是可以屏幕音效：不错，运行速度：8G +128G 速度很快，吃鸡游戏一点不卡，还是挺不错的,5
外形外观：流线型造型，轻薄手感，色彩鲜丽迷幻。屏幕音效：分辨率高，音效出色。拍照效果：拍照功能强大，是华为家的标签，这次同样没让人失望，效果杠杠的。运行速度：没有特别要求的话。这个档位的手机真的够用了，反应也很快。待机时间：刚拿到手，满足一天需求完全没问题。,5
十分愉快的一次购物，第一次在网上买手机，不负所望，超级喜欢，解锁比较快，像素清晰度比较高，特别满意，快递也是十分到位，次手机入手很舒服，很流畅，手感特别好，喜欢拿着裸机的感觉，真的棒棒的…,5
返现超慢，手机没问题，但是希望返现能快点，??，嗯，不如吃鸡神器那些来的实惠,5
送给老妈的礼物。时尚大气，漂亮，运行流畅，音效不错。老妈很喜欢。,5
基本没有认真评论过，不知道浪费了多少积分，这个福利真的很不错，值得购买，特意分享给大家。,5
外形外观：特别漂亮运行速度：速度快待机时间：电池耐用其他特色：性价比高,5
商家送了，充电宝，运动手环，荣耀原装耳机，屏幕保险。2849的价格很值。手机应用流畅，玩游戏，拍照都很出色。华为大品牌值得信赖。背面的颜色挺漂亮的。推荐购买,5
外形外观：很漂亮屏幕音效：很美丽拍照效果：非常棒运行速度：以上几个效果实验比较满意 给个好评,5
已经使用了一段时间，还挺好用的，像素也很清楚，手美观实用性强，正好赶上活动，价格很便宜。质量也非常好，与买家描述完全一致。对物品表示满意，完全超出期望值。发货速度快，晚上下单第二天早上送到了，包装非常仔细。对京东下单很满意。,5
外形外观：媳妇超喜欢屏幕音效：屏幕大，音响效果好运行速度：运行反应速度超快拍照效果：拍照效果超好,5
真心颜色好看，手机颜值高，拿在手里舒服，速回之快呐，之前也用过二个华为了，看到才上市就想先体验一把，好用，人脸识别挺好玩的，大爱拍照功能，支持华为为我带来好得体验，送的移动电充也很有份量,5
