comment,score
外观很惊艳，很难相信这是几百元的低端手机，屏幕效果心事很好，很细腻，拍照效果也不错，运行速度快，待机时间长，尤其是，5000毫安的大电池，续航时间长，不用担心电量的问题，而且价格便宜，以后买手机就是买红米，多买几个留着用，这可是我挣钱的工具，加油！,5
10天之内，买了2台！作为几百元来说的手机只能说千值万值！屏幕大又很清晰，运行速度也快，外形也漂亮。最重要的是5000毫安的大电池，确实耐用，对比了很多款同价位的手机，只有这一款综合性价比最高，确实实用，所以在之前买了一台蓝色的后，又再入一台橙色的，都很漂亮。非常喜欢！,5
宝贝已经收到了，东西非常不错，性价比很高，用起来也很流畅，5***毫安的真的很大，配合这个处理器达到极限省电。超长续航后盖的手感真的很好，好舒服，这个屏幕也很上挡次，声音很大，手感也不错，而且一点也不卡。拍照也很清晰，待机时间也很长，用2天没问题，外观也很时尚，内存也够用，是值，值得入手的一款手机，而且价格也很实惠，计划再来买一部。来说说物流投前下单，第二天就能收到货，而且快递还送货上门，热情服务,5
用了几天后，手机确实不错，也不卡，上网也很迅速，而且拍照也很清晰，计划再来买一部，送给妈妈用。,5
外形外观：外观小巧，精致，虽然是塑料的，但质感很好，拿着很舒服屏幕音效：屏幕这个价位还可以，外放很大声拍照效果：就扫个码的水平运行速度：速度很快，不卡，非常满意待机时间：一次电池，可以用2，3天，续航超级久，备用机最强了其他特色：便宜好用，老人机，备用机首选，699还能要求什么呢,5
屏幕音效：屏幕显示清晰，色彩亮丽，音效不错拍照效果：反应速度很快，拍照很清晰给老人买的，看起来很不错，试一试续航时间,5
外形外观：真的很惊艳，非常漂亮运行速度：运行速度很快，redmi手机同价位配置很高，可以看我拍的参数图。很给力屏幕音效：屏幕摸起来很光滑，音效不错呢待机时间：待机时间没话说，redmi值得信赖拍照效果：拍照很清晰，效果不错，自拍也是很好，智能的调光调色其他特色：包装很不错，物流快。手感也很好。京东买redmi手机值得信赖。,5
买给丈母娘的手机，性价比真的很高，用起来很流畅，MIUI系统果然名不虚传，电池5000毫安真的很大了，配合这个处理器真的达到极限省电，超长续航，后盖的手感真的好好，好舒服，细细的条纹，相机也很清晰，很完美，屏幕看着也不会不舒服，很清晰，当作备用机也是最佳选择,5
红米8A给老爸买的手机，外观很漂亮，时尚大气红色非常好看，手感很好，屏幕清晰，显示效果细腻，清晰，很满意，拍照效果很好，拍照挺清晰的，对老年人来说够用，运行速度挺快，不会卡顿，新手机都挺快的，大毫安电池超长待机，很满意！好评！！,5
手机物美价廉，物超所值，妈妈很喜欢，字体很大，操作简单，老年人很容易上手！拍照也很清楚，通话声音清晰，连个手机壳也没赠送,5
外观很惊艳，很难相信这是几百元的低端手机，屏幕效果心事很好，很细腻，拍照效果也不错，运行速度快，待机时间长，尤其是，5000毫安的大电池，续航时间长，不用担心电量的问题，而且价格便宜，以后买手机就是买红米，多买几个留着用，这可是我挣钱的工具，加油！,5
10天之内，买了2台！作为几百元来说的手机只能说千值万值！屏幕大又很清晰，运行速度也快，外形也漂亮。最重要的是5000毫安的大电池，确实耐用，对比了很多款同价位的手机，只有这一款综合性价比最高，确实实用，所以在之前买了一台蓝色的后，又再入一台橙色的，都很漂亮。非常喜欢！,5
宝贝已经收到了，东西非常不错，性价比很高，用起来也很流畅，5***毫安的真的很大，配合这个处理器达到极限省电。超长续航后盖的手感真的很好，好舒服，这个屏幕也很上挡次，声音很大，手感也不错，而且一点也不卡。拍照也很清晰，待机时间也很长，用2天没问题，外观也很时尚，内存也够用，是值，值得入手的一款手机，而且价格也很实惠，计划再来买一部。来说说物流投前下单，第二天就能收到货，而且快递还送货上门，热情服务,5
用了几天后，手机确实不错，也不卡，上网也很迅速，而且拍照也很清晰，计划再来买一部，送给妈妈用。,5
外形外观：外观小巧，精致，虽然是塑料的，但质感很好，拿着很舒服屏幕音效：屏幕这个价位还可以，外放很大声拍照效果：就扫个码的水平运行速度：速度很快，不卡，非常满意待机时间：一次电池，可以用2，3天，续航超级久，备用机最强了其他特色：便宜好用，老人机，备用机首选，699还能要求什么呢,5
屏幕音效：屏幕显示清晰，色彩亮丽，音效不错拍照效果：反应速度很快，拍照很清晰给老人买的，看起来很不错，试一试续航时间,5
外形外观：真的很惊艳，非常漂亮运行速度：运行速度很快，redmi手机同价位配置很高，可以看我拍的参数图。很给力屏幕音效：屏幕摸起来很光滑，音效不错呢待机时间：待机时间没话说，redmi值得信赖拍照效果：拍照很清晰，效果不错，自拍也是很好，智能的调光调色其他特色：包装很不错，物流快。手感也很好。京东买redmi手机值得信赖。,5
买给丈母娘的手机，性价比真的很高，用起来很流畅，MIUI系统果然名不虚传，电池5000毫安真的很大了，配合这个处理器真的达到极限省电，超长续航，后盖的手感真的好好，好舒服，细细的条纹，相机也很清晰，很完美，屏幕看着也不会不舒服，很清晰，当作备用机也是最佳选择,5
红米8A给老爸买的手机，外观很漂亮，时尚大气红色非常好看，手感很好，屏幕清晰，显示效果细腻，清晰，很满意，拍照效果很好，拍照挺清晰的，对老年人来说够用，运行速度挺快，不会卡顿，新手机都挺快的，大毫安电池超长待机，很满意！好评！！,5
手机物美价廉，物超所值，妈妈很喜欢，字体很大，操作简单，老年人很容易上手！拍照也很清楚，通话声音清晰，连个手机壳也没赠送,5
手机用了几天了才来评的，速度还是很快的，电量充满现在用到第三天，我用的比较省，基本就是看看来的信息，不太刷视频，偶尔京东上看看东西用了2/3，大概还能用个大半天。机子大小手感都很好，全屏视觉很干净舒服。这个价位这是无所超值！操作也很简单，自带软件不多，内存对不打游戏的我足够用，颜色也很漂亮，家里从电视，手机，摄像头用的都是小米的，个人感觉还是挺耐用的。,5
设计精美，外观非常漂亮，颜色也好看，可以说颜值担当了。多种颜色可选。很棒。全面屏幕够大，够清晰。屏幕音效：屏幕不大不小，用着正好。颜色清爽，分辨率高，很棒。音质很好，算是这个价位里不错的表现了。拍照效果：像素高，多种拍照模式可选，很好。操作简单。运行速度：速度可以，简单的应用足够了。流畅，不卡顿。待机时间：大毫安电池，待机时间长。很好。,5
一下买了两个，父母个一个，目前用的挺好的。外形外观：蓝色和橘色渐变，很时尚屏幕音效：屏幕也足够大，字体也可调很大，适合中老年人用拍照效果：拍照对于中老年，没有特别要求足够了运行速度：运行速度，新机很流畅，64g的内存也不用担心因为内存占满而卡机待机时间：正常使用，待机一天多,5
外形外观：很好看，渐变色，还有纹路屏幕音效：音响效果不错，戴上耳机效果更好，屏幕很清楚拍照效果：拍照效果一般般吧，不过对于600的手机性能已经很好了！闪光灯很亮，再也不怕维修停电啦！运行速度：也是可以的，不过脸部解锁要划多几次才反应过来，瘦的的第一天卡了一次?我买的是32g的，够用了，下载了很多软件还有9g，手机本身自带的软件内存是图上面那个，收到手机时就已经有好几个软件了待机时间：待机时间真的是,5
"真心的棒！
闪充！耐电，100度的电我可以一天都在用！
真的很奈斯
手机外观手感特好，音质也很好，哈哈哈一直在听歌。
每天都在使用wps码文件，持续了起码6小时以上，一直在听歌，边听边码，现在手机7度电我还能玩多会，一天没充了！
32g刚刚好，建议64g！
反正我是爱了爱了！！！",5
外形外观：外观挺不错，颜色也正过渡也很好。屏幕音效：只开机看了一下，启动有声音，屏幕显示也还行。拍照效果：还没用，不知道如何，应该不会让我失望，因已多次购买小米的手机。运行速度：全家都用的小米手机，5年前买的现在还正常使用，希望这个也不会让我失望才好。待机时间：小米的手机待机一直都较长时间，何况这个同是5000毫安时的，这方面很放心。其他特色：小米手机运行快，拍照过得去，待机时间长，屏幕显示也可以,5
给家里老人用的，买了一橙一蓝两个颜色，外观漂亮，声音大，字体大，运行速度很快，系统很流畅。据说电池超大超抗造……,5
疫情期间送货也是很及时的，非常感谢京东，红米挺好的，给家里老人用，字体可以调整的挺大的，屏幕很清晰，声音挺大的，联网也方便，简洁明了，老人用起来很方便，而且橙色也挺美的，正好是婆婆喜欢的颜色。感谢京东，疫情期间还能正常送货。,5
待机时间：这个手机电池非常耐用5000毫安大电池，2小时掉一个电，运行速度：运行内存是?4+64G?的反应速度快，看看我发的图片，刷刷的，看看我***就有30多个，拍照效果：拍照效果可以，清晰屏幕音效：这个超强大音量，这个手机声音特别大外形外观：手机屏幕外观也很好看，我是买蓝色的，,5
外形外观：外观很时尚很漂亮。屏幕音效：声音很大很洪亮。拍照效果：拍照效果还比较清晰。运行速度：运行速度杠杠的。待机时间：时间还有待考证。,5
外形外观：很漂亮，还是水滴屏，给老妈买的，很喜欢屏幕音效：音质不错，相当满意拍照效果：拍照效果挺好的，完全可以满足日常需求运行速度：老妈使用，不安装大型软件，日常使用没问题待机时间：待机时间是最大的亮点，普通使用过程可以用一星期，简直完美,5
给老妈买的手机，他特别喜欢红色，这个红色也特别好看，上面有细细的纹路，拍照也特别清晰，老年人用起来很舒服，屏幕很大，字很大。,5
"外形外观：出乎意料，实际到手比网页好看多了屏幕音效：声音大，音质一般般，比以前的手机声音大拍照效果：ai拍照很厉害，值得一提的底子是索尼IMX363，人家以前用在高档机器上面的，当然防抖功能是不可能加上去的。运行速度：骁龙439，网络上争议很大，说是比骁龙430强30%,红米3s我也在用，速度大概是3倍好不夸张，比骁龙650快一倍。刚转移数据那会可能后台在处理数据，半天后非常流畅，当然我指的是日常",5
外形外观：塑料后壳很独特，手感上手绝对不差，现在都是玻璃的了，很有个性屏幕音效：720P，LCD，很省电，夜晚看很友好，单扬声器，声音很大，音质说得过去拍照效果：扫码没问题，记录生活没问题，细节太要求的话不行运行速度：我不打游戏，不知道性能到底怎么样，日常付个钱聊个天，还是杠杠的待机时间：很牛，5000毫安时电池，低分辨率屏幕，续航很强，支持18W，不过随机附赠的10W差点意思其他特色：备用机中的,5
用了几天才过来评价，希望会很中肯,5
很不错，大小合适，握在手上质感很好，操作灵敏，不卡顿。屏幕细腻，色彩艳丽，很给力。声音也不错，听收音机也不用耳机可以外放很好。拍摄效果尚可，毕竟是单摄像头的，一般使用足够了。安装了几个软件运行流畅不卡顿，很棒，对于不玩游戏的我来说足够用了，五千毫安大电池正常使用三天一冲很不错小爱同学很智能很给力，基本想干什么高速他就行了，不要太方便了，全五星好评！,5
给家里老人用的，外观漂亮，声音大，字体大，运行速度很快，系统很流畅。据说电池超抗造……,5
外观漂亮，舒服。屏幕效果好，拍照清晰防抖效果也不错，这个价钱买这样的手机是几年前想都不敢想的，新手机运行速度很快，用了一段时间又来评价的，现在和开始差不多。电池容量大待机时间长，各方面性能都很好，特别适合年龄稍微大点的人使用！好评！,5
手机看了很久，最终还是选择了小米，性价比之王，物流很快就到了，拿到手很惊艳，丝毫不像1000一下的机器，系统很流畅，画面精美，不卡顿，功能很全面，触屏很灵敏，手感很好，拍照拍出来很好看，运行速度快，待机时间长真心不错，,5
老妈的手机突然充电接触不是很好，就决定在给她买台新的。选来选去还是觉得小米不错，性价比很高。这个手机的性能她用是足够了，关键是电池毫安数比较大。用着很顺手，系统也可以调大调粗字体，每个页面看的都很清楚，这也是我跟看中的一点。总之手机很不错，老人用，或者备用机都是很好的选择。,5
买了第三支红米8A手机了，都是帮朋友买的，他说说用的很好，电池非常耐用，屏幕很大很清晰，外放非常大声，运行速度也很快，做工很好，几百元的红米手机性价比无敌，**是MIUI非常顺暢顺滑好用，配置也是杠杠的，会一直支持红米的！,5
一直在京东购物，特别是电子产品，都是全新的，从来就没有碰见返修货或者二手的东西。京东的快递就更不用说了，那是相当给力啊，拿到手机的时候觉得特别惊艳，大红色的外观非常阳气，而且手机握感特别好，设计感和科技感特别强。给父母用的，再好不过了。而且，这个手机的待机时间很长，电池容量很大，之前每天都充电，现在两天一充到三天一充，而且，手机的音色饱满，拍照的时候效果特别鲜亮。还有就是，这个手机虽然是红米，但居,5
真的很不错，给爷爷用，而且还有老人非常适合用的极简桌面，真的很适合老人用，待机很长，声音也很大真的小米很合适，这个价格，简直觉得太合适了，而且这个是专门为老人做的，声音啊，比普通的都要大，屏幕大小也适合，真的很不错,5
手机正品，功能很多，尤其是小爱同学，用着很方便，需要打开什么软件直接说就行，声音辨识度很高。5000mA电池耐用，充电速度快。拿在手里很顺手，颜色漂亮。摄像头拍摄很清晰，自带美颜相机方便实用！6.22英寸大屏幕就是爽，屏幕分辨率高不刺眼。运行速度快，内存64g足够用了。主要的一点是价格价格价格重要的事情说三遍，是真实惠，非常满意！！！！,5
外形外观：十分靓丽，四处无任何磕碰，全新机器，电量足，大小也适中，非常完美。屏幕音效：屏幕还算细腻，声音比较大，看视频很舒服。如果原装的磨砂保护膜没有品牌字样就好了，可以省去重新贴膜。应该考虑送个硅胶套就更好了。拍照效果：拍照清晰度不错，基本够用了。运行速度：处理器不是太先进，如果上到635或者710就完美了。4+64的配置，老人就用来看看新闻，视频，拍拍照，足够了。待机时间：5000大电池，杠杠,5
过年回家，把摄像头装上了，为的是以后随时可以看看奶奶，奶奶也想尝试高科技的东西，我就想到买一个智能手机给她替换掉之前的老年机，比较了一下，又到实体店看了一下真机，就决定买红米了。外观没什么可评价的，智能机都大差不差，屏幕边框可接受。运行速度足够流畅了，给奶奶用绰绰有余。选这个手机最重要的一点是系统可以设置一个简单模式，所有的功能和APP都放大显示，一个屏幕好像只能显示六个APP，非常适合眼花的老人,5
质量好，送货快，嗯，拍照很清晰。待机时间很长。外观很漂亮。运行速度很快。好评。,5
刚入手这款手机，手感超好，很喜欢，声音拍照也不会差，嗯待机时间很长，待机时基本不耗电，运行速度嘛，毕竟是新机，肯定快啦，总的来说，我还是很满意的，以下附图表示我的诚意，我主要是想表达，内存够我下两部电视剧，也不卡，反正还是挺好的一款，等我再用一段时间我再来追评?,5
给老丈人买的，老婆和老丈人都很满意。哎！我还在用400块的二手机(?ì _ í?)不说了 都是泪，单说手机还不错接口方便灵活，待机时间长，屏幕大，声音大，字体大。,5
外形外观：整体大方，整洁，非常棒。屏幕音效：音质效果不错。拍照效果：拍照清晰，运行速度：反应效果快。待机时间：待机时间长，毕竟5000毫安的级别。,5
"款手机大小合适，屏幕细腻，色彩艳丽。性价比真的很高,用起来很流畅, MIUI系统果然名不虚传,电池5000毫安真的很大了，配合这个处理器真的达到极限省电,超长续航,后盖的手感真的好好，好舒服,细细的条纹,相机也很清晰,很完美,屏幕看着也不会不舒服,很清晰，当作备用机也是最佳选择。收音机不用耳机也可以外放使用，适合老年人使用。",5
外形外观：非常漂亮，手感很好，很惊艳屏幕音效：屏幕看起来比我以前的旗舰机还要棒拍照效果：拍照杠杠的，夜景效果没有白天好运行速度：买的4g运行内存足够用了，运行很快待机时间：待机最满意，5000毫安电池名不虚传，就是一个大移动电源，用一天都不需要充电，不玩游戏的情况下。其他特色：最强千元以内的机器，推荐大家购买。,5
收到手机，非常满意，给妈妈买的，好用实惠。外形观感：外观小巧，精致，虽然是塑料的，但质感很好，拿着很舒服。屏幕音效：屏幕这个价位很不错误了，外放很大声 ，非常适合老年人用。拍照效果：可以满足老人用。运行速度：速度很快，不卡，非常满意 待机时间：一次电池，可以用2，3天，续航超级久，太强了。特色：便宜好用，老人机，备用机首选，699还能要求什么呢!,5
用了几天感觉还不错，待机能带很长时间，目前已经三天了，还有一半左右的电，也不卡，挺流畅，握在手里手感十足啊，主要是电池太给力了，来打电话，玩游戏都不错，而且还可以插内存卡，真不错，物流太快了，上午11点之前买了，下午五点之前就给你送到了，真是太快了，给黄岛辛安京东小哥点赞,5
外形外观：挺时尚的，橘红渐变色，适合女性使用屏幕音效：屏幕够大，字体可以调很大，声音也够大，给父母用，声音字体屏幕都足够拍照效果：拍照对于没有特别要求的够用运行速度：64g内存足够用，再也不会因为内存沾满导致速度下降，新机运行很流畅，具体性能还要用时间验证待机时间：待机时间不错，正常使用一天完全没问题,5
外形外观：高端大气上档次屏幕音效：色彩鲜艳字体清晰，音效丰富拍照效果：日常拍照绰绰有余运行速度：很流畅！待机时间：更持久，尤其再加上快速充电，如虎添翼！老妈用了好几年的红米4换成了现在的红米8！不管从外观，屏幕，运行速度等等各个方面，都有了质的飞跃，大屏幕和大音效非常适合老人家使用！老妈很开心?！价格方面也非常实惠，性价比超高！,5
手机给老人买的，已经用了半个月了，很好用，字迹大，声音也响亮，摸起来手感也不错。小米手机，大品牌，用起来放心，平时看个视频，听个歌很方便，打起电话来声音也很清晰。手机摸起来手感很好，功能全，活动买的价格比实体店优惠很多。,5
老人用起来很方便，比以前的手机好多了，看视频，打电话很好用,5
红米8A给婆婆买的新手机，非常好看，稀罕三卡很好，很满意，好评！,5
首先还是要感谢快递小哥，过年期间下的单，又是非常时期，隔了一天就送到了，京东快递确实优质，绝对?差不多配置的手机看了很久，最后选择了这款8A，4+64平常够用了。收到货物后迫不及待的打开试机，运行流畅，色彩也可以，肯定不能和2--3千的手机比，但是同价位绝对属于顶尖了。小米经过这些年的发展，质量和工艺确实提高了很多，有需要我会再次选择，非常满意！感谢京东，提供了这么好的平台，足不出户也可以买到这么,5
外形外观：在黑色和蓝色之恋纠结，最终选择了蓝色，更亮眼一点，黑色都点沉闷，还挺好看的。屏幕音效：屏幕使用还挺方便的，可选择性也很多。声音挺大的，适合老人用。拍照效果：拍照效果可以了，老人也没那么高的要求。运行速度：新机运行速度很快，不知道能持续多久。待机时间：待机时间没时间观察，买给父亲的。,5
外形外观：外观很时尚，全铝机身！手感很好。拿起来分量刚好。屏幕分辨率也足够！赞！！！屏幕音效：分辨率在这个配置上足够用，屏幕也不错！声音够大！拍照效果：日常生活用足够清晰了，够用就行！运行速度：3G运存给小孩用来做网课作业，看直播已经足够了！待机时间：这个必须大赞！！！5000毫安真的随便用一天半到两天！真心棒！其他特色：小米系统自由度非常高，可以卸载很多软件！不用root都已经足够精简，关键一点,5
使用这段时间来看一直非常不错，关键大电量啊！！！不重度使用两天没问题！！！！赞！,5
外形外观：单手操作一点影响都没有，摸着外壳也很圆润舒服屏幕音效：屏幕看着跟我的6SP差不多，不刺眼，水滴屏幕大拍照效果：拍照拍下来效果还可以，给爸爸用的话没啥大问题运行速度：比前几代的速度快多了，装了软件也没有那么卡顿待机时间：电池够大，正常模式用下来就能用三天，超级省电其他特色：价格亲民，屏幕够大，老人用起来很顺手，不麻烦,5
外形外观：漂亮，精美。背壳有拉丝工艺，手感很好。宽度合适，可以一手掌握。屏幕大，好看。运行速度：运行速度快，至少目前是。没装多少应用，应该不会再变慢。待机时间：5000毫安电池，待机时间长，很实用。老人用很方便，不用天天充电。其他特色：3+32也够用了，老人不玩游戏，需求不高。这个很好了。,5
外形外观：外观设计非常好，颜值很高，送家里老人用的，非常开心，性价比高。很满意。屏幕音效：分辨率高，音效音质好，看电影听音乐都可以完美应对。拍照效果：操作简单，速度快。很好的解决卡顿的问题。运行速度：高速度处理器，多应用足够强大。待机时间：大毫安电池，待机时间长。特别好。,5
外形外观：蓝色很漂亮，背后有螺纹，拿着很舒服屏幕音效：屏幕看着很舒服，跟我的小米9差不多，音量比较大拍照效果：拍摄效果清晰，像素比较高，拍了一张4.34m运行速度：看新闻，短视频都比较流畅待机时间：待机时间很长，电池5000非常耐用其他特色：机子很漂亮，摄像头在中间，很舒服,5
拿到手机的时候觉得特别惊艳，大红色的外观非常阳气，而且手机握感特别好，设计感和科技感特别强。我买的是3G版的，用来做工作手机绰绰有余，再好不过了。而且，这个手机的待机时间很长，电池容量很大，我之前每天都充电，现在两天一充到三天一充，而且，手机的音色饱满，拍照的时候效果特别鲜亮。还有就是，这个手机虽然是红米，但居然有刷脸解锁的功能，我觉得特别实用。手机系统一如既往的小米范儿，太棒了。,5
疫情期间手机屏幕摔坏了用不了，临时买个备用机。Redmi 8A性价比还是蛮高的，价格非常便宜。毕竟还是新的手机，用起来还是流畅的，普通玩玩游戏也行。5000毫安电池是真的大，使用时间比较长，感觉作为老年机很合适，大屏幕，续航久。,5
